{
  "model": "Qwen/Qwen2.5-7B",
  "n_params_b": 7.62,
  "peak_layer": 17,
  "output_layer": 27,
  "hidden_dim": 3584,
  "target_ex_per_dim": 350,
  "eval_seeds": [
    43,
    44,
    45
  ],
  "widths": [
    64,
    128,
    256,
    512
  ],
  "results": {
    "baseline_pcorr": {
      "mean": 0.23560829622604484,
      "per_seed": [
        0.23470806090624277,
        0.23704534429505483,
        0.23507148347683696
      ]
    },
    "width_64": {
      "mean": 0.12864245015821968,
      "per_seed": [
        0.13398223540637222,
        0.13065730069538362,
        0.12128781437290319
      ],
      "delta_from_baseline": 0.10696584606782517
    },
    "width_128": {
      "mean": 0.13790649204944758,
      "per_seed": [
        0.13761091286599156,
        0.1373312888668273,
        0.13877727441552387
      ],
      "delta_from_baseline": 0.09770180417659727
    },
    "width_256": {
      "mean": 0.14578350169773366,
      "per_seed": [
        0.14157790784731106,
        0.15443732204003063,
        0.14133527520585923
      ],
      "delta_from_baseline": 0.08982479452831119
    },
    "width_512": {
      "mean": 0.13021714334939888,
      "per_seed": [
        0.12490128952320413,
        0.13716153030498326,
        0.12858861022000923
      ],
      "delta_from_baseline": 0.10539115287664597
    },
    "conclusion": "signal_survives"
  },
  "provenance": {
    "model_revision": "d149729398750b98c0af14eb82c78cfe92750796",
    "script": "scripts/roc_width_sweep.py",
    "timestamp": "2026-04-14T01:58:04+00:00",
    "value_source": "post_hoc_deterministic",
    "device": "cuda"
  }
}